{
  "$schema": "../schemas/HybridStudioExtension.schema.json",
  "format": "HybridTileStudioExtension",
  "id": "example.world-health",
  "name": "World Health Example",
  "version": "1.0.0",
  "description": "Example declarative validator and Studio panel.",
  "publisher": "local-example",
  "permissions": ["map:read", "project:validate", "ui:contribute"],
  "contributes": {
    "brushes": [],
    "generators": [],
    "validators": [{ "id": "example.world-health.transfers", "name": "Transfer Health" }],
    "recipeNodes": [],
    "panels": [{ "id": "example.world-health.panel", "title": "World Health" }]
  }
}
